scenario_id,scenario_type,cas_usage,step,context,intent,patient_dit,ia_repond,keywords,skip_step_if_motif_detected,action_attendue,valide,remarques,parent_id,type_patient,canal,condition_metier,variantes,,,,,,,,,,
IMPL_2,scenario_principal,Implantologie,2,Patient n’a pas encore fait d’imagerie,prise_rdv_implantologie,"Non, je n’ai rien encore.",Pas de souci. Nous allons vous proposer un premier rendez-vous pour évaluer votre situation et envisager les étapes suivantes. Êtes-vous disponible en début de semaine prochaine ?,"implantologie,première consultation,pas d’imagerie,début parcours implant,bilan clinique,rien,début",false,proposer_consultation_initiale,,Permet d’initier le parcours implantologie,IMPL_1,nouveau,téléphone,Consultation clinique initiale obligatoire,On va planifier une première consultation pour faire le point.,,,,,,,,,,
IMPL_3,scenario_principal,Implantologie,2,Patient a déjà des examens,prise_rdv_implantologie,"Oui, j’ai un panoramique et un scanner.",Parfait. Pouvez-vous nous envoyer ces documents par mail à contact@cabinetdentaire.fr ? Nous les transmettrons au Dr Dupont avant la consultation.,"implantologie,examens existants,panoramique,scanner,transmettre documents,préparer consultation,radio,images",false,collecter_docs_et_transmettre_praticien,,Permet d’optimiser la première consultation,IMPL_1,nouveau ou existant,téléphone,Anticiper et pré-évaluer le traitement,Cela nous aidera à mieux préparer votre rendez-vous.,,,,,,,,,,
ORTHO_2,scenario_principal,Orthodontie enfant,2,Première consultation,prise_rdv_ortho_enfant,Ce serait la première fois.,"Très bien. Nous allons planifier une première consultation de diagnostic avec le Dr X. Elle coûte XXX € et n’est pas toujours remboursée par la Sécurité sociale, mais peut l’être par votre mutuelle.","orthodontie enfant,première consultation,diagnostic,devis,coût consultation,remboursement mutuelle,avis,voir",false,proposer_consult_diagnostic,,Informer sur coût et remboursement,ORTHO_1,enfant,téléphone,"Consultation diagnostic facturable, imagerie possible",Souhaitez-vous qu’on regarde les créneaux disponibles ?,,,,,,,,,,
ORTHO_3,scenario_principal,Orthodontie enfant,2,"Suivi existant, transfert de dossier",prise_rdv_ortho_enfant,"Elle est suivie ailleurs, mais on déménage.","Très bien. Pour assurer la continuité, pouvez-vous nous transmettre son ancien dossier et ses dernières radios si possible ?","orthodontie enfant,suivi transféré,ancien dossier,radios,continuité traitement,déménagement,changement",false,demander_dossier_precedent,,Transmission du dossier utile pour évaluation,ORTHO_1,enfant,téléphone,Transfert = nouvelle consultation d’évaluation,Cela permettra au praticien d'évaluer précisément la suite du traitement.,,,,,,,,,,
ORTHO_AD_2,scenario_principal,Orthodontie adulte,2,Première consultation,prise_rdv_ortho_adulte,Je n’ai jamais consulté.,Très bien. Nous allons organiser une première consultation avec le Dr X. Elle coûte XXX € et un devis sera établi à l’issue si un traitement est envisageable.,"orthodontie adulte,première consultation,diagnostic,devis,non remboursé,mutuelle,aligner,adulte",false,proposer_consult_diagnostic,,"Consultation souvent non remboursée, mutuelle potentielle",ORTHO_AD_1,adulte,téléphone,Diagnostic préalable au devis,Souhaitez-vous prendre rendez-vous la semaine prochaine ?,,,,,,,,,,
ORTHO_AD_3,scenario_principal,Orthodontie adulte,2,Suivi transféré d’un autre cabinet,prise_rdv_ortho_adulte,"Je suis déjà en traitement, je viens de déménager.","Très bien. Pouvez-vous nous envoyer votre dossier actuel (radios, plan de traitement, etc.) ? Cela aidera le praticien à reprendre le suivi.","orthodontie adulte,suivi transféré,reprise traitement,dossier existant,radios,plan traitement,continuer,reprendre",false,collecte_dossier_et_evaluation,,Consultation d’évaluation malgré le suivi en cours,ORTHO_AD_1,adulte,téléphone,Reprise de traitement = consultation préalable,Le praticien analysera les documents avant votre venue.,,,,,,,,,,
PAM_1,scenario_principal,Prothèse amovible,2,Demande initiale pour appareil amovible,prise_rdv_prothese_amovible,"Je voudrais faire un appareil dentaire, une prothèse.",Très bien. Le praticien commence toujours par une consultation pour évaluer la situation et proposer les options les plus adaptées. Souhaitez-vous un rendez-vous pour cela ?,"prothèse,appareil dentaire,appareil amovible,dentier,consultation,empreinte,plan de traitement,fausses dents,râtelier",false,proposer_consult_prothétique,,Consultation initiale avant toute prise d’empreinte ou plan de traitement,,adulte,téléphone,"Facturation possible, empreintes selon décision",Une première consultation est indispensable avant tout plan.,,,,,,,,,,
PAM_2,scenario_principal,Prothèse amovible,2,Prothèse cassée ou ancienne,reparation_ou_remplacement_prothese,"Mon appareil est cassé / ancien, je voudrais le faire refaire.",Je comprends. Nous allons organiser un rendez-vous pour évaluer l’état de votre prothèse actuelle et discuter d’un éventuel remplacement.,"prothèse cassée,appareil cassé,dentier abîmé,réparation,remplacement,prothèse ancienne,empreinte,réparer,coller",false,prise_rdv_evaluation_prothese_existante,,Réparation possible selon fracture / adaptation,,adulte,téléphone,Certains cas nécessitent une nouvelle empreinte,Le praticien vous dira si une réparation est possible ou s’il faut envisager un remplacement.,,,,,,,,,,
PFIX_1,scenario_principal,Prothèse fixe,2,Demande de couronne,prise_rdv_couronne,"Je dois poser une couronne, j’ai eu un devis.",Très bien. Avez-vous déjà effectué un rendez-vous préparatoire ou faut-il organiser une première consultation avec le praticien ?,"couronne,prothèse fixe,devis,empreinte,rendez-vous préparatoire,diagnostic,pose couronne,céramique,dent abîmée",false,identifier_preparation_ou_diagnostic,,Vérifier si empreinte déjà faite ou non,,adulte,téléphone,Prévoir étape selon l’avancement du traitement,Souhaitez-vous un rendez-vous avec le Dr X qui a établi le devis ?,,,,,,,,,,
PFIX_2,scenario_principal,Prothèse fixe,2,Remplacement d’une ancienne couronne,remplacement_couronne,"Ma couronne est tombée / abîmée, il faut la refaire.",Je comprends. Je vais vous proposer un rendez-vous pour que le praticien évalue la situation et propose une solution adaptée.,"couronne tombée,couronne abîmée,remplacement couronne,prothèse fixe,diagnostic,réparation,devis,décimentée,partie",false,prise_rdv_diagnostic_remplacement,,Cas fréquent nécessitant contrôle et devis,,adulte,téléphone,Facturation possible si soins à refaire,Nous organiserons un examen pour évaluer la dent support.,,,,,,,,,,
PARO_1,scenario_principal,Soins parodontaux,2,Demande d’un bilan parodontal,prise_rdv_bilan_parodontal,"J’ai les gencives qui saignent, je pense qu’il faut un traitement.",Je comprends. Le praticien propose un bilan parodontal complet pour évaluer la santé de vos gencives. Souhaitez-vous un rendez-vous pour cela ?,"parodontal,gencives,gencives qui saignent,déchaussement,bilan parodontal,traitement gencives,sang,rouge",false,proposer_bilan_parodontal,,Consultation spécialisée souvent hors nomenclature,,adulte,téléphone,Prévoir durée et coût du bilan,Un bilan complet permet de mesurer l’atteinte parodontale.,,,,,,,,,,
PARO_2,scenario_principal,Soins parodontaux,2,Patient déjà traité souhaite un contrôle,controle_suivi_parodontal,"J’ai déjà été traité pour un déchaussement, je dois faire un contrôle.",Très bien. Je vais regarder pour vous proposer un rendez-vous de suivi parodontal avec le praticien.,"suivi parodontal,contrôle gencives,déchaussement,traitement parodontal,suivi régulier,contrôle,maintenance,vérifier",false,prise_rdv_suivi_parodontal,,Fréquence de suivi importante (tous les 6 mois parfois),,adulte,téléphone,Assurer la continuité thérapeutique,Vous avez effectué votre dernier contrôle il y a combien de temps ?,,,,,,,,,,
PARO_5,scenario_principal,Soins parodontaux,2,Demande de traitement pour récession gingivale,prise_rdv_recession_gingivale,"J’ai une dent qui se déchausse, on voit la racine, c’est gênant.",Je comprends. Le praticien pourra évaluer s’il est possible d’envisager un traitement de la récession gingivale. Souhaitez-vous un rendez-vous pour un bilan parodontal complet ?,"récession gingivale,gencives,racine visible,dent qui se déchausse,traitement gencives,bilan parodontal,longue,descend",false,prise_rdv_bilan_recession,,Le traitement dépend de la profondeur de la récession et des facteurs mécaniques ou inflammatoires,PARO_1,adulte,téléphone,"Traitement chirurgical parfois proposé, devis à prévoir",Il est important d’agir tôt pour stabiliser ou corriger une récession.,,,,,,,,,,
ENC_02,scenario_principal,Patiente enceinte,2,Demande d’anesthésie locale,anesthesie_locale,Est-ce qu’on peut faire une anesthésie pendant la grossesse ?,"Oui, certaines anesthésies locales sont autorisées pendant la grossesse. Le dentiste s’adaptera à votre trimestre.","grossesse,anesthésie,anesthésie locale,soins dentaires enceinte,sécurité grossesse,précautions,piqûre,endormir",false,informer_et_transmettre_au_praticien,patiente_enceinte,existante,,Utilisation prudente des anesthésiques,téléphone,,Le praticien vous confirmera la faisabilité.,,,,,,,,,,
ENC_03,scenario_principal,Patiente enceinte,2,Demande de radio panoramique,radio_panoramique,"Je suis enceinte, est-ce que je peux faire une radio ?",Les radiographies sont évitées durant la grossesse sauf nécessité. Le dentiste décidera si cela est indispensable.,"grossesse,radio panoramique,radiographie,rayons X,radioprotection,sécurité grossesse,cliché,rayon",false,orienter_et_informer,patiente_enceinte,existante,,Radioprotection,téléphone,,Le praticien évaluera la balance bénéfice/risque.,,,,,,,,,,
ENC_06,scenario_principal,Patiente enceinte,2,Demande de soins esthétiques (blanchiment),blanchiment_grossesse,Je voulais faire un blanchiment dentaire mais je suis enceinte.,"Par précaution, nous déconseillons les traitements esthétiques pendant la grossesse. Souhaitez-vous un simple contrôle ?","grossesse,blanchiment dentaire,esthétique,soins esthétiques,contre-indication,différé,dents blanches",false,proposer_alternative,patiente_enceinte,existante,,Esthétique différée,téléphone,,Nous pourrons envisager cela après l'accouchement.,,,,,,,,,,
ENC_07,scenario_principal,Patiente enceinte,2,Demande si MEOPA possible,meopa_et_grossesse,"Je suis très stressée, est-ce qu’on peut faire une sédation douce ?",Le MEOPA est généralement évité pendant la grossesse. Le praticien confirmera la meilleure solution pour vous.,"grossesse,meopa,sédation,gaz hilarant,relaxation,anxiété,contre-indication,peur,stresse",false,informer_et_notifier_praticien,patiente_enceinte,existante,,Contre-indication potentielle,téléphone,,Nous allons voir ce qui peut vous soulager.,,,,,,,,,,
ENC_09,scenario_principal,Patiente enceinte,2,Demande combien de temps elle peut rester allongée,position_allongee,"Je ne peux pas rester allongée longtemps, c’est un problème ?",C’est noté. Nous en informerons le praticien qui fera des pauses pendant le soin.,"grossesse,position allongée,inconfort,soin allongé,pause,adaptation soins,dos,ventre",false,ajuster_soin_et_prevenir_equipe,patiente_enceinte,existante,,Position inconfortable,téléphone,,Nous adapterons la durée de la séance.,,,,,,,,,,
ENC_10,scenario_principal,Patiente enceinte,2,Demande si prise en charge spécifique,prise_en_charge_grossesse,Est-ce que j’ai droit à un remboursement spécifique en tant que femme enceinte ?,Certaines séances peuvent être prises en charge à 100%. Je vous invite à vérifier auprès de votre caisse d’assurance maladie.,"grossesse,remboursement,prise en charge,sécurité sociale,mutuelle,maternité,100%,gratuit",false,informer_et_rediriger,patiente_enceinte,existante,,Suivi maternité,téléphone,,Vous pouvez aussi consulter votre mutuelle.,,,,,,,,,,
RDV_patient_existant_3A,scenario_principal,RDV patient existant,3,Choix du praticien,prise_rdv,"Oui, avec le Dr Dupont","Très bien, je vais regarder les créneaux disponibles pour le Dr Dupont.","rdv existant,choix praticien,préférence patient,filtrage praticien,mon dentiste,celui de d'habitude",false,filtrer_par_praticien,,Patient demande un praticien précis,RDV_motif_existant,existant,téléphone,Filtrage par praticien,Je vérifie les disponibilités du Dr Dupont.,,,,,,,,,,
RDV_patient_existant_3B,scenario_principal,RDV patient existant,3,Choix du praticien oublié,prise_rdv,Je ne me souviens plus du nom,"Pas de souci, je vais chercher selon vos informations. Pouvez-vous me rappeler votre nom ?","rdv existant,praticien oublié,identité patient,recherche consultation,praticien inconnu,sais plus,oublié",false,identifier_identité,,Recherche sans nom praticien,RDV_motif_existant,existant,téléphone,"Cas fréquent, nécessite recherche",Je vais voir les dernières consultations à votre nom.,,,,,,,,,,
RDV_patient_existant_3C,scenario_principal,RDV patient existant,3,Aucune préférence,prise_rdv,"Peu importe, celui qui est disponible le plus vite","D’accord, je vais chercher les premiers créneaux disponibles tous praticiens confondus.","rdv existant,praticien indifférent,premier créneau,disponibilité rapide,orientation libre,plus tôt,le plus tôt possible,n'importe qui,égal",false,proposer_creneaux_global,,Optimisation du planning,RDV_motif_existant,existant,téléphone,Orientation libre,Je vous propose le premier créneau disponible.,,,,,,,,,,
RDV_existant_praticien_absent,scenario_principal,RDV patient existant,3,Praticien habituel indisponible,prise_rdv,Je voudrais voir le Dr Dupont.,Le Dr Dupont est absent cette semaine. Souhaitez-vous un rendez-vous avec un autre praticien ?,"rdv existant,praticien absent,remplacement praticien,indisponibilité,orientation alternative,vacances,pas là",false,rediriger_vers_autre_praticien,,Prévoir info praticiens absents,RDV_existant_hors_horaires,existant,téléphone,Remplacement possible selon protocole,"Un confrère peut vous recevoir à sa place, souhaitez-vous que je vérifie ?",,,,,,,,,,
URG_sans_disponibilite,scenario_principal,Urgence patient existant,3,Aucune disponibilité immédiate au cabinet,urgence,"C’est vraiment urgent, j’ai mal depuis deux jours.","Je suis désolée, tous nos créneaux sont complets aujourd’hui. Souhaitez-vous que je vous mette sur liste d’attente ou vous orienter vers un autre service ?","urgence,pas de disponibilité,liste attente,orientation,surcharge agenda,mal,souffre",false,proposer_alternative_ou_liste_attente,,Inclure protocole cabinet pour gestion de surcharge,URG_interne_douleur_vive,existant,téléphone,"Aucune disponibilité directe, alternatives nécessaires",Nous sommes malheureusement complets. Puis-je vous inscrire sur liste d’attente ou vous rediriger vers un confrère ?,,,,,,,,,,
NP_contrainte_horaire,scenario_principal,Nouveau patient,3,Le patient a des contraintes horaires,prise_rdv,"Je travaille tous les jours, je suis dispo que le soir.",Nous allons chercher les créneaux les plus compatibles avec vos disponibilités. Préférez-vous plutôt en début de matinée ou en fin de journée ?,"nouveau patient,contrainte horaire,soir,matinée,compatibilité agenda,travail,dispo",false,filtrer_creneaux,,Prend en compte contraintes patient,NP_motif_consultation,nouveau,téléphone,Plage horaire adaptée,"D’accord, je vais vérifier les disponibilités compatibles avec vos horaires.",,,,,,,,,,
CORR_4,scenario_principal,Patient référé par correspondant,3,Patient demande un rendez-vous rapide,prise_rdv_referent,Est-ce que je peux avoir un rendez-vous rapidement ?,Je vais voir ce que nous pouvons faire selon les disponibilités. Pourriez-vous m’indiquer vos créneaux préférés ?,"patient référé,demande rapide,urgence relative,praticien correspondant,rdv prioritaire,vite,pressé",false,recherche_urgence_referent,,Filtrer si vraiment urgent ou non,CORR_3,nouveau,téléphone,Accélération selon demande et type d’indication,Je regarde avec le praticien pour prioriser au besoin.,,,,,,,,,,
ENF_4,scenario_principal,Patient enfant,3,Rendez-vous pour contrôle ou douleur,prise_rdv_enfant,C’est pour un contrôle / il a mal à une dent.,Je vais vous proposer un créneau adapté. Êtes-vous disponibles en dehors des heures scolaires ?,"patient enfant,contrôle,douleur enfant,horaires scolaires,créneau enfant,école,mercredi",false,proposer_rdv_enfant,,"Proposer horaires adaptés (mercredi, soir, vacances)",ENF_2,enfant,téléphone,Créneaux enfants selon politique du cabinet,Préférez-vous un rendez-vous mercredi ou en fin de journée ?,,,,,,,,,,
IMPL_4,scenario_principal,Implantologie,5,Patient souhaite connaître le tarif,demande_devis_implantologie,Combien ça coûte un implant chez vous ?,Le tarif dépend de votre situation clinique. Une consultation est indispensable pour établir un devis personnalisé. Souhaitez-vous prendre rendez-vous ?,"implant,tarif implant,devis,consultation obligatoire,estimation prix,prix,coût",false,proposer_consultation_avec_devis,,Éviter de donner un devis sans évaluation,IMPL_2,nouveau,téléphone,Consultation = devis,Nous préférons évaluer précisément avant de vous donner un tarif.,,,,,,,,,,
ESTH_3,scenario_principal,Soins esthétiques,5,Demande sur tarif et remboursement,info_tarif_remboursement_esthetique,Est-ce que c’est remboursé ? Et combien ça coûte ?,"Les soins esthétiques ne sont pas pris en charge par la Sécurité sociale. Les tarifs varient selon l’indication, mais un devis précis vous sera remis après la consultation.","esthétique,blanchiment,facettes,tarif,remboursement,devis,combien,cher",false,informer_tarif_non_rembourse,,Sensibiliser au reste à charge et prévoir devis,"ESTH_1,ESTH_2",adulte,téléphone,Mentionner mutuelle possible selon contrat,Un devis sera établi à l'issue de la première consultation.,,,,,,,,,,
PAM_3,scenario_principal,Prothèse amovible,5,Patient veut connaître tarif et prise en charge,info_tarif_remboursement_prothese,Est-ce que c’est remboursé ? Et combien ça coûte ?,"Certaines prothèses amovibles sont partiellement remboursées par la Sécurité sociale, et un devis vous sera remis à l’issue de la consultation selon les options retenues.","prothèse amovible,tarif,remboursement,devis,sécurité sociale,prix,combien",false,informer_tarif_protheses,,Varie selon la base de remboursement (100% santé ou pas),"PAM_1,PAM_2",adulte,téléphone,Mentionner le devis systématique,Le devis vous permettra de savoir ce que couvre votre mutuelle.,,,,,,,,,,
PFIX_3,scenario_principal,Prothèse fixe,5,Demande sur tarif et remboursement,info_tarif_remboursement_couronne,C’est combien une couronne ? Est-ce que c’est remboursé ?,"Le tarif dépend du matériau utilisé et du type de couronne. Certaines sont prises en charge dans le cadre du 100% Santé, d’autres avec un reste à charge. Un devis vous sera remis lors de la consultation.","couronne,tarif couronne,remboursement,devis,100% santé,matériau,prix,combien",false,informer_tarif_et_devis,,"Adapter la réponse selon type de couronne (céramo, zircone…)","PFIX_1,PFIX_2",adulte,téléphone,Remboursement selon nomenclature / mutuelle,Nous pourrons vous expliquer les options remboursées et esthétiques.,,,,,,,,,,
CONFLIT_refus_chgt_praticien_10,scenario_principal,Conflit ou refus de soin,1,Patient refuse de changer de praticien en cas d’indisponibilité,refus_changement_praticien,C’est le Dr Dupont ou personne !,Je comprends votre préférence. Le Dr Dupont est absent cette semaine. Souhaitez-vous patienter ou consulter un autre praticien ?,"conflit,refus praticien,praticien unique,indisponibilité,préférence,veux lui,pas un autre",false,laisser_choix_patient,admin_conflit,existant,,Proposer alternatives sans conflit,téléphone,,Je peux vous inscrire avec lui dès son retour ou vous proposer un autre rendez-vous avant.,,,,,,,,,,
RDV_existant_hors_horaires,scenario_principal,RDV patient existant,4,Demande hors horaires,prise_rdv,Est-ce que je peux avoir un rendez-vous samedi ou après 19h ?,"Le cabinet est ouvert du lundi au vendredi, de 9h à 18h. Souhaitez-vous un rendez-vous le matin ou l’après-midi ?","rdv existant,hors horaires,samedi,soirée,après 19h,19h,adaptation horaires,limite ouverture,weekend,tard",false,proposer_creneaux_disponibles,,Limiter les propositions selon config cabinet,RDV_existant_urgence,existant,téléphone,Adaptation selon jours/heures ouverts,"Je suis navrée, nous ne consultons pas le samedi. Est-ce que jeudi ou vendredi après-midi vous conviendrait ?",,,,,,,,,,
RDV_patient_existant_4,scenario_principal,RDV patient existant,4,Demande complémentaire,prise_rdv,"Un contrôle, comme tous les six mois",D’accord. Vous souhaitez un détartrage également ?,"rdv existant,contrôle,suivi régulier,complément soins,vérif,habituel",false,demander_motif,,Routine de contrôle,RDV_patient_existant_3C,existant,téléphone,Compléter les soins,Souhaitez-vous que l'on fasse également un détartrage ?,,,,,,,,,,
URG_demande_sans_motif,scenario_principal,Urgence patient inconnu,4,Patient demande un RDV en urgence sans motif clair,urgence,"C’est urgent, il faut absolument que je vienne aujourd’hui.",Pouvez-vous me préciser ce qui vous inquiète ? Cela m’aidera à vous orienter rapidement.,"urgence,motif flou,triage,clarification,priorisation,absolument,grave",false,clarifier_motif,,Permet de trier les fausses urgences,,inconnu,téléphone,Triage selon douleur ou urgence réelle,"Je comprends, pouvez-vous me dire ce qui motive votre demande urgente ?",,,,,,,,,,
IMPL_5,scenario_principal,Implantologie,5,Information sur les examens complémentaires,information_scanner_implantologie,"Très bien, je prends rendez-vous.","Lors de la consultation, le praticien pourra être amené à réaliser un scanner pour évaluer le volume osseux disponible. Ce scanner coûte environ XXX € et n’est pas remboursé par la Sécurité sociale, mais peut être pris en charge par certaines mutuelles.","implant,scanner,examen complémentaire,coût scanner,devis implant,ok,d'accord",false,informer_patient_scanner_et_tarif,,Important à anticiper pour éviter les mauvaises surprises,IMPL_4,nouveau,téléphone,Information financière à donner avant consultation,Nous vous informerons également sur les éventuels examens complémentaires à prévoir.,,,,,,,,,,
PAM_4,scenario_principal,Prothèse amovible,4,Patient demande combien de temps cela prend,delais_prothese_amovible,Et combien de temps faut-il pour faire un appareil ?,"Cela dépend du type de prothèse. En général, il faut prévoir plusieurs rendez-vous : prise d’empreinte, essayage, puis pose. Le praticien vous expliquera les étapes lors de la consultation.","prothèse amovible,délais,étapes,empreinte,pose,planning labo,durée,long",false,expliquer_deroulement_protheses,,Variable selon nombre de dents et retours labo,"PAM_1,PAM_2",adulte,téléphone,Prévoir planning en fonction des délais labo,Comptez en moyenne 2 à 4 semaines selon les cas.,,,,,,,,,,
PFIX_4,scenario_principal,Prothèse fixe,4,Demande couronne sur implant,prise_rdv_couronne_implant,J’ai un implant et je dois poser la couronne.,Très bien. Il est important que le praticien vérifie la compatibilité du pilier avec la couronne à poser. Je vais vous proposer un rendez-vous pour cela.,"couronne implant,pilier,compatibilité,pose couronne,implantologie,dessus,finir",false,organiser_rdv_pose_sur_implant,,Pas toujours même praticien selon pose / prothèse,,adulte,téléphone,Prévoir matériel spécifique et coordination,Avez-vous les références du pilier implantaire déjà posé ?,,,,,,,,,,
PARO_4,scenario_principal,Soins parodontaux,5,Demande sur tarifs et remboursement,info_tarif_remboursement_paro,Est-ce que le traitement est remboursé ?,"Certains soins parodontaux sont hors nomenclature. Le praticien vous remettra un devis clair à l’issue du bilan initial, à transmettre à votre mutuelle.","parodontal,tarif,remboursement,hors nomenclature,devis paro,prix,combien",false,informer_tarif_paro,,Transparence sur les actes hors nomenclature,PARO_1,adulte,téléphone,Éviter surprises post-traitement,Certains soins peuvent être partiellement pris en charge par la mutuelle.,,,,,,,,,,
CONFLIT_refus_soin_esthetique_2,scenario_principal,Conflit ou refus de soin,4,Patient estime que les soins esthétiques devraient être pris en charge,refus_tarif_esthetique,Je ne comprends pas pourquoi je dois payer autant pour un blanchiment !,C’est un soin non pris en charge par la Sécurité sociale. Nous pouvons revoir ensemble le devis ou en parler avec le praticien.,"conflit,esthétique,blanchiment,tarif,remboursement refusé,cher,abusé",false,clarifier_tarif,admin_conflit,existant,ESTH_4,Explication claire des actes non remboursés,téléphone,,Je vous envoie les informations détaillées par email si vous le souhaitez.,,,,,,,,,,
RDV_patient_existant_5,scenario_principal,RDV patient existant,4,Proposition de créneaux,prise_rdv,"Oui, s'il vous plaît.",Voici les créneaux disponibles pour un détartrage : demain 10h30 ou vendredi 15 septembre à 15h. Lequel vous conviendrait ?,"rdv existant,proposition créneaux,choix patient,prise rdv,agenda,ok,ça marche",false,proposer_creneaux,,Cas de réponse affirmée,RDV_patient_existant_4,existant,téléphone,Créneaux multiples à choix,Voici ce que nous avons : demain à 10h30 ou vendredi à 15h.,,,,,,,,,,
