scenario_id,scenario_type,cas_usage,step,context,intent,patient_dit,ia_repond,keywords,skip_step_if_motif_detected,action_attendue,valide,remarques,parent_id,type_patient,canal,condition_metier,variantes,,,,,,,,,,
URG_interne_sans_dispo_praticien_habituel,scenario_principal,Urgence patient existant,5,Douleur mais praticien habituel indisponible,urgence,"Je suis suivi par le Dr Martin, mais j’ai très mal.","Le Dr Martin n’est pas disponible aujourd’hui, mais un autre praticien peut vous recevoir en urgence. Souhaitez-vous que je vous programme avec lui ?","urgence,praticien habituel absent,remplacement,douleur,orientation alternative,mal,souffre",false,proposer_rdv_avec_autre_praticien,,Prévoir politique de délégation,URG_interne_douleur_vive,existant,téléphone,Absence du praticien référent,"Le Dr Martin est absent, mais je peux vous proposer un rendez-vous avec un autre dentiste du cabinet.",,,,,,,,,,
NP_recommandation_externe,scenario_principal,Nouveau patient,5,Patient a été recommandé par un tiers,prise_rdv,C’est une amie qui m’a recommandé votre cabinet.,Nous sommes ravis ! Je vais vous proposer un rendez-vous. Est-ce que vous avez un praticien en tête ou souhaitez-vous qu’on vous oriente ?,"nouveau patient,recommandé,bouche-à-oreille,choix praticien,orientation,conseillé,dit du bien",false,choisir_ou_attribuer_praticien,,Peut influencer choix praticien,,nouveau,téléphone,Réputation du cabinet,Merci pour votre confiance ! Souhaitez-vous consulter un dentiste en particulier ?,,,,,,,,,,
PFIX_5,scenario_principal,Prothèse fixe,5,Patient souhaite discuter des matériaux disponibles,discussion_materiaux_couronne,Quelle est la différence entre une couronne céramique et métal ?,"Chaque matériau a ses avantages : la céramique est très esthétique, le métal-céramique plus résistant. Le praticien vous expliquera les options adaptées selon votre dent. Souhaitez-vous un rendez-vous pour en discuter ?","couronne,matériaux,céramique,métal-céramique,esthétique,résistance,différence,mieux",false,prise_rdv_conseil_materiaux,,"La sélection dépend de la localisation, esthétique, et remboursement","PFIX_1,PFIX_2",adulte,téléphone,Prévoir discussion sur reste à charge si hors 100% Santé,Le praticien vous conseillera selon la position de la dent et vos attentes esthétiques.,,,,,,,,,,
CONFLIT_patient_agressif_3,scenario_principal,Conflit ou refus de soin,5,Patient parle sur un ton agressif,agressivite,C’est inadmissible ! Je paie une fortune et on me traite comme ça ?!,Je suis là pour vous aider. Je vous propose de vérifier ensemble ce qui s’est passé pour trouver une solution.,"conflit,patient agressif,agressivité,ton élevé,désamorcer conflit,scandale,honte",false,desamorcer_conflit,admin_conflit,existant,téléphone,Posture empathique et calme,téléphone,,Je comprends votre mécontentement. Voyons cela ensemble.,,,,,,,,,,
CONFLIT_delai_trop_long_6,scenario_principal,Conflit ou refus de soin,1,Patient refuse de venir car délai trop long,refus_delai,"Je ne veux pas attendre trois semaines, je vais ailleurs.",Je comprends. Je peux vous inscrire sur notre liste d’attente et vous prévenir si une place se libère plus tôt.,"conflit,refus délai,attente longue,liste attente,orientation patient,trop long,ailleurs",false,proposer_alternative_attente,admin_conflit,existant,,Offrir solution sans conflit,téléphone,,Souhaitez-vous que je vous contacte si un créneau se libère avant ?,,,,,,,,,,
CONFLIT_refus_soin_sans_mutuelle_8,scenario_principal,Conflit ou refus de soin,1,Patient ne veut pas avancer les frais,refus_avance_frais,"Je ne veux rien payer aujourd’hui, vous enverrez à ma mutuelle.","Je comprends. Cependant, nous demandons une avance pour les soins non pris en charge. Souhaitez-vous que je vous établisse un devis ?","conflit,refus avance frais,mutuelle,paiement direct,devis,pas payer,avance",false,proposer_devis,admin_conflit,existant,,Clarifier règle d’avance de frais,téléphone,,Je peux vous transmettre les informations pour anticiper la prise en charge.,,,,,,,,,,
RDV_patient_existant_6,scenario_principal,RDV patient existant,6,Confirmation du créneau,prise_rdv,"Vendredi à 15h, c’est parfait","Parfait, je vous note pour vendredi à 15h pour un contrôle. À très bientôt !","rdv existant,confirmation créneau,validation rdv,clôture agenda,parfait,super",false,confirmer_rdv,,Clôture de la prise de rendez-vous,RDV_patient_existant_5,existant,téléphone,Validation finale,C’est noté ! À vendredi alors. | Je peux vous envoyer une confirmation par email si vous le souhaitez.,,,,,,,,,,
NP_creation_fiche_incomplete,scenario_principal,Nouveau patient,6,Patient ne veut pas donner toutes les infos dès le départ,prise_rdv,Je préfère ne pas donner mon adresse maintenant.,"Pas de souci, nous compléterons votre fiche lors de votre venue au cabinet. J’ai bien noté votre nom et téléphone.","nouveau patient,fiche incomplète,infos manquantes,prise rdv,identité minimale,pas dire,secret",false,creation_fiche_partielle,,Ne pas bloquer la prise de rdv,,nouveau,téléphone,Infos minimales suffisantes,"Aucun problème, nous complèterons le reste lors de votre consultation.",,,,,,,,,,
CONFLIT_refus_implant_non_remb_1,scenario_principal,Conflit ou refus de soin,6,Patient refuse l’implant à cause du prix,refus_implant,"Je ne veux pas faire d’implant, c’est trop cher !",Je comprends. Nous pouvons en discuter avec le praticien pour envisager des alternatives adaptées à votre budget.,"conflit,refus implant,prix élevé,alternative soin,prothèse,cher,pas les moyens",false,proposer_alternative_soin,admin_conflit,existant,IMPL_5,Proposer prothèse amovible ou autre option,téléphone,,Souhaitez-vous que je voie si une autre solution est envisageable ?,,,,,,,,,,
URG_triage_1,scenario_principal,Urgence patient,2,Triage de l'urgence,affiner_diagnostic_urgence,"J'ai une douleur dentaire intense, ça fait très mal, je ne sais pas si c'est grave ou pas","Pouvez-vous me préciser si la douleur est spontanée, au chaud ou au froid ? Cela m'aide à mieux comprendre le type de problème.","urgence,douleur dent,triage,diagnostic initial,pulpite possible,mal,souffre,grave",false,identifier_type_douleur,,Peut indiquer une pulpite ou une sensibilité post-traumatique,"URG_interne_douleur_vive, URG_externe_non_connu",existant/nouveau,téléphone,Triage pour adapter la réponse et l'urgence,Est-ce que la douleur est continue ou en pic ?,,,,,,,,,,
URG_triage_1B,scenario_principal,Urgence patient,2,Triage de la douleur - pulpite/symptômes,triage_douleur_precise,"J'ai une douleur qui apparaît toute seule sans raison, sans manger ni boire, c'est une douleur spontanée qui lance","Est-ce que la douleur apparaît toute seule, sans rien faire (on appelle ça une douleur spontanée) ? Ou bien elle apparaît uniquement quand vous mangez, buvez chaud ou froid ?","urgence,douleur dent,douleur spontanée,douleur provoquée,pulpite,mal,lance,toute seule",false,distinguer_spontanée_vs_provoquée,,Permet de différencier pulpite réversible ou irréversible,URG_triage_1,existant/nouveau,téléphone,Diagnostic d'orientation initial,La douleur vient-elle toute seule ou quand vous mastiquez ?,,,,,,,,,,
URG_triage_1C,scenario_principal,Urgence patient,2,Douleur persistante et signes d'aggravation,triage_douleur_continue_nuit,"J'ai une douleur constante qui ne s'arrête pas, même la nuit, les médicaments ne font plus effet, ça me réveille","La douleur est-elle continue, même au repos ? Est-ce qu'elle vous réveille la nuit ou résiste aux médicaments contre la douleur ?","urgence,douleur continue,douleur nocturne,aggravation,infection possible,tout le temps,nuit,réveille,médicaments",false,evaluer_gravite_douleur,,Douleur nocturne et résistante = pulpite sévère ou infection,URG_triage_1,existant,téléphone,À prioriser + éventuelle prescription préalable,Est-ce que la douleur s'aggrave le soir ou la nuit ?,,,,,,,,,,
URG_triage_1D,scenario_principal,Urgence patient,2,Douleur à la mastication,triage_douleur_mastication,"J'ai mal quand je mastique, quand je croque quelque chose de dur, ça lance dans la mâchoire",Est-ce que la douleur apparaît surtout quand vous mastiquez ou croquez ? Cela peut nous aider à comprendre s'il y a une fissure ou une infection autour de la racine.,"urgence,douleur mastication,fissure,abcès,percussion,mange,croque,mâcher,dur",false,identifier_douleur_mastication,,"Évoque fissure, abcès, ou douleur d'occlusion",URG_triage_1,existant,téléphone,Peut orienter vers imagerie ou test de percussion,Est-ce que cela fait plus mal quand vous mâchez ?,,,,,,,,,,
URG_triage_2,scenario_principal,Urgence patient,2,Triage de l'urgence,identifier_zone_urgence,"J'ai une douleur dentaire", "où est-ce que ça fait mal exactement, c'est en haut ou en bas, à gauche ou à droite ?, Pouvez-vous me dire où se situe la douleur exactement ? En haut, en bas, à gauche, à droite ?","urgence,localisation douleur,zone dentaire,triage,secteur buccal,où,endroit,haut,bas,gauche,droite",false,identifier_zone_buccale,,Permet d'anticiper la complexité du cas,URG_interne_douleur_vive,existant,téléphone,Préparer le praticien au bon secteur,Est-ce une douleur localisée ou diffuse ?,,,,,,,,,,
URG_triage_3,scenario_principal,Urgence patient,2,Suspicion de fracture ou traumatisme,triage_fracture_urgence,"Je me suis cogné la dent, j'ai eu un choc, un traumatisme, j'ai peur qu'elle soit cassée ou déplacée",Avez-vous constaté une fracture visible ou un déplacement de la dent ? Est-ce que la dent bouge ?,"urgence,traumatisme,fracture dent,choc dentaire,dent déplacée,coup,tombé,cogné,cassée",false,évaluer_traumatisme_dentaire,,Traumatismes → délais courts à privilégier,URG_interne_douleur_vive,existant,téléphone,Possible orientation vers prise en charge prioritaire,La dent est-elle cassée ou seulement sensible ?,,,,,,,,,,
URG_triage_4,scenario_principal,Urgence patient,2,Suspicion de gonflement ou infection,triage_infection_urgence,"Ma joue est gonflée, j'ai un gonflement sur le visage, il y a peut-être une infection ou un abcès",Est-ce que le gonflement est douloureux ? Depuis combien de temps cela a-t-il commencé ? Avez-vous de la fièvre ?,"urgence,infection,gonflement,fièvre,œdème,risque médical,gonflé,boule,abcès,joue",false,evaluer_signes_infectieux,,Urgence médicale potentielle si fièvre ou œdème important,URG_interne_douleur_vive,existant,téléphone,Peut nécessiter antibiotique ou hospitalisation,Est-ce que la douleur empêche de dormir ou manger ?,,,,,,,,,,
ETR_03,scenario_principal,Patient étranger,1,Demande s’il peut venir avec un traducteur,besoin_traducteur,Puis-je venir avec quelqu’un pour traduire ?,"Oui, bien sûr. Un proche peut vous accompagner pour faciliter la communication.","étranger,traducteur,accompagnant,langue,communication,ami,famille",false,confirmer_presence_accompagnant,patient_etranger,nouveau,,Autorisation accompagnant,téléphone,,Vous pouvez venir avec quelqu’un si besoin.,,,,,,,,,,
ETR_04,scenario_principal,Patient étranger,1,Carte européenne d’assurance maladie,remboursement_mutuelle_etrangere,"J’ai une carte européenne d’assurance maladie, est-ce remboursé ?",La CEAM est acceptée pour certains soins. Le praticien vous confirmera lors de la consultation.,"étranger,carte européenne,CEAM,remboursement,mutuelle étrangère,europe,card",false,notifier_praticien_et_collecter_infos,patient_etranger,nouveau,,Accord CEAM,téléphone,,Certains actes peuvent rester à charge.,,,,,,,,,,
ETR_05,scenario_principal,Patient étranger,1,Sans couverture sociale ni mutuelle,soin_sans_couverture,"Je n’ai pas de sécurité sociale ni mutuelle, je peux quand même venir ?","Oui, mais les soins seront à votre charge. Le praticien vous indiquera le tarif avant l’intervention.","étranger,sans couverture,paiement direct,devis,mutuelle absente,payer,cash",false,confirmer_acceptation_sans_couverture,patient_etranger,nouveau,,Paiement à l’acte,téléphone,,Vous pourrez décider après avoir eu le devis.,,,,,,,,,,
ETR_06,scenario_principal,Patient étranger,1,Demande remboursement blanchiment,blanchiment_remboursement,Will the whitening be reimbursed in France?,"No, cosmetic treatments like whitening are not covered. I can give you a quote if you want.","étranger,blanchiment,remboursement,esthétique non couvert,devis,money,insurance",false,clarifier_non_remboursement,patient_etranger,nouveau,,Esthétique non remboursée,téléphone,,Ask your private insurance if they cover it.,,,,,,,,,,
ETR_07,scenario_principal,Patient étranger,1,Souhaite un email en anglais,confirmation_rdv_traduite,Can I get the appointment details by email in English?,"Yes, I’ll send you the appointment summary in English.","étranger,email anglais,confirmation rdv,traduction,communication écrite,mail,send",false,envoyer_mail_anglais,patient_etranger,nouveau,,Email personnalisé,téléphone,,You will receive all the details shortly.,,,,,,,,,,
ETR_08,scenario_principal,Patient étranger,1,Demande si un praticien parle sa langue,recherche_praticien_langue,Est-ce qu’un dentiste parle espagnol ?,"Oui, je peux vous proposer un rendez-vous avec un praticien qui parle espagnol.","étranger,praticien langue,espagnol,traduction,orientation linguistique,spanish,habla",false,filtrer_praticien_langue,patient_etranger,nouveau,,Assignation linguistique,téléphone,,Je vérifie la langue parlée par nos praticiens.,,,,,,,,,,
ETR_09,scenario_principal,Patient étranger,1,Nom difficile à comprendre,confirmer_identite_etranger,"My name is Xiu Zhen, I’m not sure how you’ll find me.",Can you spell it for me? Could you also say it letter by letter?,"no french,english,foreign,spell,épeler,lettre par lettre,name spelling,write,letters",false,identifier_patient_prudemment,patient_etranger,existant,,Nom ambigu,téléphone,,Date of birth may help too.,,,,,,,,,,
ETR_10,scenario_principal,Patient étranger,1,Refus d’aide malgré barrière de langue,refus_traduction,"No translator, I handle myself.",As you wish. I’ll speak slowly and help you step by step. Can I take your name and phone number please?,"étranger,refus traducteur,barrière langue,communication lente,adaptation,alone,ok",false,protocole_sans_traduction,patient_etranger,nouveau,,Barrière persistante,téléphone,,"We’ll manage together, no worries.",,,,,,,,,,
ENC_01,scenario_principal,Patiente enceinte,1,Patiente enceinte demande si elle peut recevoir des soins,question_soins_generaux,"Je suis enceinte, est-ce que je peux faire un soin dentaire ?","Oui, de nombreux soins sont possibles pendant la grossesse. Le praticien adaptera le traitement si nécessaire. Souhaitez-vous un rendez-vous de contrôle ?","grossesse,soins dentaires,soins possibles,adaptation grossesse,contrôle,bébé,enceinte",false,rassurer_et_proposer_rdv,patiente_enceinte,existante,,Adapter selon trimestre,téléphone,,Nous adapterons les soins à votre situation.,,,,,,,,,,
ENC_04,scenario_principal,Patiente enceinte,1,Demande un contrôle de routine,controle_classique_grossesse,Je suis enceinte et je voulais faire un contrôle classique.,Bien sûr. Il est recommandé de faire un contrôle durant la grossesse. Je vous propose un rendez-vous rapidement.,"grossesse,contrôle,suivi grossesse,prévention,hygiène bucco-dentaire,vérifier,routine",false,proposer_rdv_prioritaire,patiente_enceinte,existante,,Hygiène bucco-dentaire prioritaire,téléphone,,On vous proposera un créneau adapté.,,,,,,,,,,
ENC_05,scenario_principal,Patiente enceinte,1,Douleur dentaire durant la grossesse,urgence_enceinte,J’ai très mal à une dent et je suis enceinte.,Nous allons vous proposer un rendez-vous d’urgence avec toutes les précautions nécessaires. Quel est votre nom complet ?,"grossesse,douleur dentaire,urgence enceinte,protocole,sécurité,mal,souffre",false,identifier_et_prioriser_urgence,patiente_enceinte,existante,,Protocole douleur et grossesse,téléphone,Urgence prioritaire patiente enceinte; adapter selon trimestre.,j’ai mal et je suis enceinte | douleur enceinte | urgence grossesse,,,,,,,,,,
ENC_08,scenario_principal,Patiente enceinte,1,Demande si elle doit prévenir son obstétricien,coordination_medecins,Dois-je informer mon gynécologue avant de venir ?,"C’est recommandé. Si vous avez un suivi particulier, vous pouvez apporter un courrier ou l’ordonnance de votre médecin.","grossesse,coordination,obstétricien,gynécologue,suivi médical,médecin,avis",false,encourager_coordination,patiente_enceinte,existante,,Grossesse à risque,téléphone,Coordination avec suivi obstétrique recommandée.,prévenir gynécologue | coordonner avec obstétricien | informer mon médecin,,,,,,,,,,
ADMIN_horaires_secretariat_1,scenario_principal,Demande administrative,0,Demande d’horaires du secrétariat,info_horaires_secretariat, je voudrais connaître les horaires d’ouverture du secrétariat.,"Le secrétariat est ouvert du lundi au vendredi, de 9h à 18h. Souhaitez-vous autre chose ?","horaires,secrétariat,ouverture,heures,téléphone,quand,joindre",false,donner_horaires_secretaire,admin_demande,inconnu,,Utiliser la configuration horaires_secretaire,téléphone,Utiliser `horaires_secretaire` depuis config.,horaires secrétariat | horaires téléphone | quand êtes-vous joignable,,,,,,,,,,
ADMIN_horaires_cabinet_1,scenario_principal,Demande administrative,0,Demande d’horaires du cabinet,info_horaires_cabinet,Quels sont les horaires du cabinet ?,"Le cabinet est ouvert du lundi au vendredi, de 8h30 à 19h30. Puis-je vous aider pour autre chose ?","horaires,cabinet,ouverture,heures,ouvert,fermé",false,donner_horaires_cabinet,admin_demande,inconnu,,Utiliser la configuration horaires_ouverture,téléphone,Utiliser `horaires_ouverture` depuis config.,horaires cabinet | horaires consultation | quand êtes-vous ouverts,,,,,,,,,,
ADMIN_adresse_cabinet_1,scenario_principal,Demande administrative,0,Demande d’adresse,info_adresse,Quelle est l’adresse exacte du cabinet ?,Notre adresse est 224 avenue du Prado 13008 Marseille. Souhaitez-vous un rendez-vous ?,"adresse,localisation,venir,où,rue",false,donner_adresse,admin_demande,inconnu,,Utiliser adresse_cabinet,téléphone,Utiliser `adresse_cabinet` depuis config.,où êtes-vous situé | adresse | localisation,,,,,,,,,,
ADMIN_itineraire_1,scenario_principal,Demande administrative,0,Demande d’itinéraire,info_itineraire,Comment venir en transport ou en voiture ?,Nous sommes au 224 avenue du Prado 13008 Marseille. Stationnement et transports à proximité. Souhaitez-vous un rendez-vous ?,"itinéraire,venir,transport,voiture,stationnement,bus,métro,parking",false,donner_indications_breves,admin_demande,inconnu,,Réponse courte sans liste,téléphone,Utiliser `parking_info` si disponible dans config.,comment venir | accès | stationnement | transport,,,,,,,,,,
ADMIN_contact_1,scenario_principal,Demande administrative,0,Demande de contact,info_contact,Avez-vous un email ou un numéro ?,Vous pouvez nous joindre au +33491776044 ou par email à kanoun.riima@gmail.com.,"contact,téléphone,email,joindre,mail,numéro",false,donner_coordonnees,admin_demande,inconnu,,Utiliser telephone_cabinet et email_cabinet,téléphone,Utiliser `telephone_cabinet` et `email_cabinet` depuis config.,numéro de téléphone | email | comment vous joindre,,,,,,,,,,
ADMIN_paiement_1,scenario_principal,Demande administrative,0,Demande moyens de paiement,info_moyens_paiement,Quels moyens de paiement acceptez-vous ?,"Nous acceptons CB, chèque et espèces.","paiement,cb,chèque,espèces,carte,payer",false,donner_moyens_paiement,admin_demande,inconnu,,Utiliser mode_paiement_acceptes,téléphone,Utiliser `mode_paiement_acceptes` depuis config.,moyens de paiement | carte bancaire | chèque | espèces,,,,,,,,,,
ADMIN_rdv_en_ligne_1,scenario_principal,Demande administrative,0,Prise de RDV en ligne,info_rdv_en_ligne,Puis-je prendre rendez-vous en ligne ?,"Oui, vous pouvez passer par Doctolib. Souhaitez-vous que je regarde une date ?","rdv en ligne,doctolib,internet,site,web",false,orienter_plateforme_en_ligne,admin_demande,inconnu,,Utiliser prise_rdv_en_ligne et plateforme_rdv,téléphone,Utiliser `prise_rdv_en_ligne` et `plateforme_rdv` depuis config.,rdv en ligne | doctolib | prendre rdv sur internet,,,,,,,,,,
ADMIN_envoi_radios_1,scenario_principal,Demande administrative,0,Envoi de radios,info_envoi_radios,Où puis-je envoyer mes radios ?,Vous pouvez les envoyer à sebban.vartanyan@gmail.com.,"radios,envoyer radios,images,mail,transmettre",false,donner_adresse_envoi_radios,admin_demande,inconnu,,Répondre uniquement si envoi_radios=true,téléphone,Activer si `envoi_radios=true` dans config.,envoyer radios | adresse envoi | email radios,,,,,,,,,,
ADMIN_delais_secretaire_1,scenario_principal,Demande administrative,0,Délai de rappel secrétariat,info_delais_rappel,Quand allez-vous me rappeler ?,Le secrétariat rappelle sur ses horaires (9h–18h) généralement sous 24 h ouvrées.,"rappel,délai,secrétariat,attente,quand",false,donner_delais_rappel,admin_demande,inconnu,,Utiliser horaires_secretaire,téléphone,Utiliser `horaires_secretaire` pour calculer délai.,quand rappelez-vous | délai rappel | quand me rappelez-vous,,,,,,,,,,
RDV_pref_jour_1,scenario_principal,RDV patient existant,4,Préférence de jour/partie de journée,rdv_pref_creneau,Je préfère mardi matin.,"Très bien, je regarde un créneau mardi matin et je vous propose le premier disponible.","préférence,mardi,matin,après-midi,jour,lundi,mercredi,jeudi,vendredi",false,filtrer_creneaux_par_jour,existant,téléphone,Jour et/ou partie de journée détectés.,mardi matin | jeudi après-midi | préférence vendredi,,,,,,,,,,,,,
RDV_praticien_indispo_1,scenario_principal,RDV patient existant,3,Praticien souhaité indisponible,rdv_praticien_indisponible,Je voudrais le Dr X mais il n’est pas dispo.,Le Dr X n’a pas de disponibilité proche. Souhaitez-vous voir un autre praticien plus rapidement ?,"praticien indisponible,remplacement,alternative,pas dispo,indisponible,n’a pas de disponibilité,autre,quelqu'un d'autre",false,proposer_autre_praticien,existant,téléphone,Praticien demandé indisponible; autres praticiens disponibles.,praticien indisponible | pas de dispo avec ce docteur | autre praticien,,,,,,,,,,,,,
RDV_samedi_soir_hors_horaires_1,scenario_principal,RDV patient existant,4,Demande hors horaires,rdv_hors_horaires,Avez-vous samedi soir ?," ""Le cabinet est fermé à ces horaires. Je peux vous proposer le prochain créneau disponible en semaine.""","samedi,soir,hors horaires,après 19h,19h,weekend,dimanche",false,proposer_alternative_horaire,existant,téléphone,Utiliser `horaires_ouverture` pour valider.,samedi | après 19h | hors horaires | dimanche,,,,,,,,,,,,,
RDV_double_duree_1,scenario_principal,RDV patient existant,4,Besoin de créneau long,rdv_long,Je voudrais un détartrage et parler d’un soin.,Je vous propose un créneau un peu plus long adapté.,"double durée,long,deux actes,plus de temps,deux choses",false,proposer_creneau_long,existant,téléphone,Prévoir 2x durée standard si possible.,deux actes | détartrage + soin | rendez-vous long,,,,,,,,,,,,,
RDV_suivi_vs_controle_1,scenario_principal,RDV patient existant,2,Suivi explicite,rdv_suivi,C’est pour un suivi.,"Très bien, je note un rendez-vous de suivi avec votre praticien habituel.","suivi,contrôle,revue,vérification,comme d'hab",false,orienter_suivi_praticien,existant,téléphone,Utiliser praticien habituel si connu dans dossier.,rendez-vous de suivi | contrôle de suivi | suivi traitement,,,,,,,,,,,,,
RDV_contrainte_horaire_1,scenario_principal,RDV patient,4,Contrainte horaire spécifique,rdv_contrainte,Je ne peux qu’entre midi et deux.,Je cherche un créneau compatible et je vous propose le premier disponible.,"contrainte horaire,midi,12h-14h,déjeuner,pause",false,filtrer_creneaux_contrainte,existant/nouveau,téléphone,Tranche horaire spécifique détectée.,entre midi et deux | 12h-14h | seulement le matin,,,,,,,,,,,,,
RDV_liste_attente_1,scenario_principal,RDV patient,4,Inscription liste d’attente,rdv_liste_attente,Rien ne me convient.,Je peux vous inscrire sur liste d’attente et vous rappeler dès qu’un créneau se libère.,"liste d’attente,rappel,prévenir,libère",false,inscrire_liste_attente,existant/nouveau,téléphone,Système liste d’attente actif.,liste d’attente | rien ne convient | me rappeler,,,,,,,,,,,,,
RDV_avec_document_1,scenario_principal,RDV patient,3,Apporte documents,rdv_avec_docs,J’apporterai mes radios/devis.,"Parfait, je le note au dossier et je vous propose un rendez-vous adapté.","radios,devis,documents,papier,dossier",false,noter_document_et_planifier,existant/nouveau,téléphone,Noter dans `patient_context` pour transmission praticien.,j’apporterai mes radios | j’aurai mes documents | je viens avec mes radios,,,,,,,,,,,,,
RDV_apres_voyage_1,scenario_principal,RDV patient,3,Contrainte voyage,rdv_avant_apres_voyage,Je pars la semaine prochaine.,Je peux vous proposer avant votre départ ou juste à votre retour.,"voyage,départ,retour,vacances,absent",false,proposer_avant_ou_apres,existant/nouveau,téléphone,Date de départ/retour détectée; filtrer créneaux.,je pars la semaine prochaine | avant mon départ | après mon retour,,,,,,,,,,,,,
RDV_urgence_sans_dispo_1,scenario_principal,Urgence patient,3,Agenda plein en urgence,urgence_sans_dispo,C’est urgent mais vous n’avez pas de place.,"Je vous mets en liste d’attente et, si besoin, je vous oriente vers le service de garde.","urgence,pas de disponibilité,plein,complet",false,proposer_attente_ou_garde,existant/nouveau,téléphone,Utiliser `politique_urgences` et `numero_urgence` si config.,urgence sans dispo | pas de place en urgence | agenda plein,,,,,,,,,,,,,
